{
  "$schema": "https://json-schema.org/draft/2020-12/schema",
  "$id": "https://segment-scanner.invalid/schemas/config-v1.schema.json",
  "type": "object",
  "additionalProperties": false,
  "required": ["schemaVersion","mode","paths","resources","credits","exports","server"],
  "properties": {"schemaVersion":{"const":1},"mode":{"enum":["Offline","ConnectedWorker"]},"paths":{"$ref":"#/$defs/paths"},"resources":{"$ref":"#/$defs/resources"},"credits":{"$ref":"#/$defs/credits"},"exports":{"$ref":"#/$defs/exports"},"server":{"oneOf":[{"type":"null"},{"$ref":"#/$defs/server"}]}},
  "$defs": {"paths":{"type":"object","additionalProperties":false,"required":["stateDirectory","cacheDirectory","ffmpeg","ffprobe","python","inferenceScript","mappings","allowedMediaRoots"],"properties":{"stateDirectory":{"type":"string","minLength":1},"cacheDirectory":{"type":"string","minLength":1},"ffmpeg":{"type":"string","minLength":1},"ffprobe":{"type":"string","minLength":1},"python":{"type":"string","minLength":1},"inferenceScript":{"type":"string","minLength":1},"mappings":{"type":"array","items":{"$ref":"#/$defs/mapping"}},"allowedMediaRoots":{"type":"array","items":{"type":"string","minLength":1}}}},"mapping":{"type":"object","additionalProperties":false,"required":["id","serverPrefix","workerPrefix","caseSensitive"],"properties":{"id":{"type":"string"},"serverPrefix":{"type":"string","minLength":1},"workerPrefix":{"type":"string","minLength":1},"caseSensitive":{"type":["boolean","null"]}}},"resources":{"type":"object","additionalProperties":false,"required":["concurrentJobs","ffmpegThreads","inferenceThreads","maximumTemporaryGigabytes","processTimeoutSeconds","inferenceTimeoutSeconds","maximumCacheMegabytes"],"properties":{"concurrentJobs":{"const":1},"concurrentFiles":{"enum":[1,2,4],"default":2},"ffmpegThreads":{"type":"integer","minimum":1,"maximum":32},"inferenceThreads":{"type":"integer","minimum":1,"maximum":32},"maximumTemporaryGigabytes":{"type":"number","exclusiveMinimum":0},"processTimeoutSeconds":{"type":"integer","minimum":1},"inferenceTimeoutSeconds":{"type":"integer","minimum":1},"maximumCacheMegabytes":{"type":"integer","minimum":1}}},"credits":{"type":"object","additionalProperties":false,"required":["profileId","modelManifest","sampleIntervalSeconds","lookbackFractions","refinementFramesPerSecond","startOffsetSeconds","endOffsetSeconds","blackOnlyFallback","decisionProfile"],"properties":{"inferenceBackend":{"enum":["Cpu","OpenClGpu"],"default":"Cpu"},"videoDecoder":{"enum":["Cpu","NvidiaNvdec","IntelQuickSync"],"default":"Cpu"},"profileId":{"type":"string","minLength":1},"modelManifest":{"type":["string","null"]},"sampleIntervalSeconds":{"type":"number","exclusiveMinimum":0},"lookbackFractions":{"type":"array","minItems":1,"maxItems":10,"uniqueItems":true,"items":{"type":"number","exclusiveMinimum":0,"maximum":1}},"refinementFramesPerSecond":{"type":"number","exclusiveMinimum":0},"startOffsetSeconds":{"type":"number"},"endOffsetSeconds":{"type":"number"},"blackOnlyFallback":{"const":false},"decisionProfile":{"$ref":"#/$defs/profile"}}},"profile":{"type":"object","additionalProperties":false,"required":["id","featureVersion","productionApproved","evaluationReportHash","minimumPositiveSamples","minimumSpanSeconds","maximumBlankGapSeconds","minimumTextFraction","minimumTextWidth","minimumTextHeight","subtitleBandStart","nearBlackRatio","staticDifferenceThreshold"],"properties":{"id":{"type":"string","minLength":1},"featureVersion":{"type":"string","minLength":1},"productionApproved":{"type":"boolean"},"evaluationReportHash":{"type":["string","null"]},"minimumPositiveSamples":{"type":"integer","minimum":2},"minimumSpanSeconds":{"type":"number","exclusiveMinimum":0},"maximumBlankGapSeconds":{"type":"number","minimum":0},"minimumTextFraction":{"type":"number","exclusiveMinimum":0,"maximum":1},"minimumTextWidth":{"type":"number","exclusiveMinimum":0,"maximum":1},"minimumTextHeight":{"type":"number","exclusiveMinimum":0,"maximum":1},"subtitleBandStart":{"type":"number","exclusiveMinimum":0,"maximum":1},"nearBlackRatio":{"type":"number","exclusiveMinimum":0,"maximum":1},"staticDifferenceThreshold":{"type":"number","minimum":0}}},"exports":{"type":"object","additionalProperties":false,"required":["enabled","writer","xmlLayout","jsonSidecar","preserveUnknownFiles","overwriteModifiedOwnedFiles","mirroredRoot"],"properties":{"enabled":{"type":"boolean"},"writer":{"enum":["Worker","MsChapter"]},"xmlLayout":{"enum":["MsChapterCompatible","Adjacent"]},"jsonSidecar":{"type":"boolean"},"preserveUnknownFiles":{"const":true},"overwriteModifiedOwnedFiles":{"const":false},"mirroredRoot":{"type":["string","null"]}}},"server":{"type":"object","additionalProperties":false,"required":["baseUrl","credentialEnvironmentVariable","requireTlsValidation","allowInsecureHttp","workerId","pollSeconds","heartbeatSeconds"],"properties":{"baseUrl":{"type":"string","format":"uri"},"credentialEnvironmentVariable":{"type":"string","minLength":1},"requireTlsValidation":{"const":true},"allowInsecureHttp":{"type":"boolean"},"workerId":{"type":"string","minLength":1},"node":{"$ref":"#/$defs/node"},"pollSeconds":{"type":"integer","minimum":1},"heartbeatSeconds":{"type":"integer","minimum":1}}},"node":{"type":"object","additionalProperties":false,"required":["name","libraryIds","modes","leaseMinutes"],"properties":{"automaticImports":{"type":"boolean","default":false},"configured":{"type":"boolean","default":false},"name":{"type":"string","minLength":1,"maxLength":200},"libraryIds":{"type":"array","maxItems":100,"uniqueItems":true,"items":{"type":"string","format":"uuid"}},"modes":{"type":"array","maxItems":5,"uniqueItems":true,"items":{"enum":["Introduction","Credits","Recap","Preview","Commercial"]}},"leaseMinutes":{"type":"integer","minimum":1,"maximum":120}}}}
}
